{
  "meta": {
    "generated_at": "2026-09-02T22:53:47.365668Z",
    "toolkit_sha": "51ed7da64d04",
    "vplanner_version": "v4",
    "rounds_total": 6,
    "tables_total": 30,
    "engine": "template-universe-engine/generate.py (stdlib-only)"
  },
  "stages": {
    "t0_survey": {
      "stage_id": "t0_survey",
      "module": "ingest/t0_survey.py",
      "round_stage": "survey",
      "cc_module": "M1",
      "order": 0,
      "outputs": [
        {
          "path_template": "control-center-state/rounds/round-NNN.json",
          "kind": "round",
          "schema": "schemas/round-file.schema.json",
          "condition": "always"
        },
        {
          "path_template": "data/escalation-log.jsonl",
          "kind": "ledger",
          "schema": null,
          "condition": "always"
        },
        {
          "path_template": "data/tracker.json",
          "kind": "ledger",
          "schema": "schemas/ledger-row.schema.json",
          "condition": "always"
        }
      ]
    },
    "t1_scope_scan": {
      "stage_id": "t1_scope_scan",
      "module": "ingest/t1_scope_scan.py",
      "round_stage": "survey",
      "cc_module": "M1",
      "order": 1,
      "outputs": [
        {
          "path_template": "data/scope/scan-model.json",
          "kind": "scope",
          "schema": null,
          "condition": "always"
        }
      ]
    },
    "t1_discovery": {
      "stage_id": "t1_discovery",
      "module": "ingest/t1_discovery.py",
      "round_stage": "scope_grounding",
      "cc_module": "M2",
      "order": 2,
      "outputs": [
        {
          "path_template": "data/discovery/clusters.json",
          "kind": "discovery",
          "schema": null,
          "condition": "if_no_ratified_scope"
        },
        {
          "path_template": "data/discovery/discovery-summary.json",
          "kind": "discovery",
          "schema": null,
          "condition": "always"
        },
        {
          "path_template": "data/entity-packs/discovered.json",
          "kind": "discovery",
          "schema": null,
          "condition": "always (blind-start vocab)"
        },
        {
          "path_template": "data/scope/scope.json",
          "kind": "scope",
          "schema": null,
          "condition": "always"
        }
      ]
    },
    "t1_ke_scan": {
      "stage_id": "t1_ke_scan",
      "module": "ingest/t1_ke_scan.py",
      "round_stage": "scope_grounding",
      "cc_module": "M2",
      "order": 3,
      "outputs": [
        {
          "path_template": "data/ke-cache.json",
          "kind": "ke",
          "schema": null,
          "condition": "if_ke_signals"
        },
        {
          "path_template": "data/ke-scan-summary.json",
          "kind": "unknown",
          "schema": null,
          "condition": "always"
        },
        {
          "path_template": "data/ke-terms.json",
          "kind": "ke",
          "schema": null,
          "condition": "if_ke_signals"
        }
      ]
    },
    "t1b_scope_apply": {
      "stage_id": "t1b_scope_apply",
      "module": "ingest/t1b_scope_apply.py",
      "round_stage": "scope_grounding",
      "cc_module": "M2",
      "order": 4,
      "outputs": [
        {
          "path_template": "data/scope/scope.json",
          "kind": "scope",
          "schema": null,
          "condition": "always"
        }
      ]
    },
    "t3_extract": {
      "stage_id": "t3_extract",
      "module": "extract/t3_extract.py",
      "round_stage": "extraction",
      "cc_module": "M4",
      "order": 5,
      "outputs": [
        {
          "path_template": "data/fragments/_code-index.jsonl",
          "kind": "fragment",
          "schema": "schemas/fragment.schema.json",
          "condition": "if_fragments"
        },
        {
          "path_template": "data/fragments/_index.jsonl",
          "kind": "fragment",
          "schema": "schemas/fragment.schema.json",
          "condition": "if_fragments"
        },
        {
          "path_template": "data/fragments/{SRC-ID}/{fragment_id}.json",
          "kind": "fragment",
          "schema": "schemas/fragment.schema.json",
          "condition": "always"
        }
      ]
    },
    "t4_conflicts": {
      "stage_id": "t4_conflicts",
      "module": "assess/conflicts.py",
      "round_stage": "assessment",
      "cc_module": "M5",
      "order": 6,
      "outputs": [
        {
          "path_template": "data/conflicts.json",
          "kind": "conflict",
          "schema": null,
          "condition": "if_extracted"
        },
        {
          "path_template": "data/dup-ledger.json",
          "kind": "conflict",
          "schema": null,
          "condition": "if_extracted"
        }
      ]
    },
    "t4b_consolidate": {
      "stage_id": "t4b_consolidate",
      "module": "assess/consolidate.py",
      "round_stage": "assessment",
      "cc_module": "M5",
      "order": 7,
      "outputs": [
        {
          "path_template": "data/conflicts.json",
          "kind": "conflict",
          "schema": null,
          "condition": "if_extracted"
        },
        {
          "path_template": "data/consolidated.json",
          "kind": "consolidation",
          "schema": null,
          "condition": "if_assessed"
        }
      ]
    },
    "t5_ratify": {
      "stage_id": "t5_ratify",
      "module": "serve/rollup.py",
      "round_stage": "population",
      "cc_module": "M6",
      "order": 8,
      "outputs": [
        {
          "path_template": "data/INDEX.md",
          "kind": "unknown",
          "schema": null,
          "condition": "always"
        },
        {
          "path_template": "data/budget.json",
          "kind": "rollup",
          "schema": null,
          "condition": "always"
        },
        {
          "path_template": "data/conflicts.json",
          "kind": "conflict",
          "schema": null,
          "condition": "if_extracted"
        },
        {
          "path_template": "data/consolidated.json",
          "kind": "consolidation",
          "schema": null,
          "condition": "if_assessed"
        },
        {
          "path_template": "data/escalation-log.jsonl",
          "kind": "ledger",
          "schema": null,
          "condition": "always"
        },
        {
          "path_template": "data/escalations.json",
          "kind": "rollup",
          "schema": null,
          "condition": "always"
        },
        {
          "path_template": "data/status.json",
          "kind": "rollup",
          "schema": null,
          "condition": "always"
        }
      ]
    },
    "plan": {
      "stage_id": "plan",
      "module": "plan/generator.py",
      "round_stage": "population",
      "cc_module": "M6",
      "order": 9,
      "outputs": [
        {
          "path_template": "data/atomic-task-list.json",
          "kind": "unknown",
          "schema": "schemas/atomic-unit.schema.json",
          "condition": "always"
        },
        {
          "path_template": "data/atomic-units.json",
          "kind": "plan",
          "schema": "schemas/atomic-unit.schema.json",
          "condition": "always"
        },
        {
          "path_template": "data/budget.json",
          "kind": "rollup",
          "schema": null,
          "condition": "always"
        },
        {
          "path_template": "data/consolidated.json",
          "kind": "consolidation",
          "schema": null,
          "condition": "if_assessed"
        },
        {
          "path_template": "data/dependency-edges.json",
          "kind": "plan",
          "schema": "schemas/dependency-edge.schema.json",
          "condition": "always"
        },
        {
          "path_template": "data/dispatch-plan.json",
          "kind": "plan",
          "schema": null,
          "condition": "always"
        },
        {
          "path_template": "data/escalations.json",
          "kind": "rollup",
          "schema": null,
          "condition": "always"
        }
      ]
    },
    "rollup": {
      "stage_id": "rollup",
      "module": "serve/rollup.py",
      "round_stage": "population",
      "cc_module": "M6",
      "order": 10,
      "outputs": [
        {
          "path_template": "data/INDEX.md",
          "kind": "unknown",
          "schema": null,
          "condition": "always"
        },
        {
          "path_template": "data/budget.json",
          "kind": "rollup",
          "schema": null,
          "condition": "always"
        },
        {
          "path_template": "data/conflicts.json",
          "kind": "conflict",
          "schema": null,
          "condition": "if_extracted"
        },
        {
          "path_template": "data/consolidated.json",
          "kind": "consolidation",
          "schema": null,
          "condition": "if_assessed"
        },
        {
          "path_template": "data/escalation-log.jsonl",
          "kind": "ledger",
          "schema": null,
          "condition": "always"
        },
        {
          "path_template": "data/escalations.json",
          "kind": "rollup",
          "schema": null,
          "condition": "always"
        },
        {
          "path_template": "data/status.json",
          "kind": "rollup",
          "schema": null,
          "condition": "always"
        }
      ]
    },
    "control_center": {
      "stage_id": "control_center",
      "module": "serve/control_center.py",
      "round_stage": "freeze",
      "cc_module": "M7",
      "order": 11,
      "outputs": [
        {
          "path_template": "data/budget.json",
          "kind": "rollup",
          "schema": null,
          "condition": "always"
        },
        {
          "path_template": "data/cc-data.json",
          "kind": "control_center",
          "schema": null,
          "condition": "always"
        },
        {
          "path_template": "data/cc-round.json",
          "kind": "control_center",
          "schema": null,
          "condition": "if_publish"
        },